Headlines,Descriptions,Authors,Published_Dates,Articles,Keywords,Summaries
The long road to recovery,Redundant rehab practices and social pressure hinder recovering drug users from sustaining their sobriety,,2011-01-07 00:00:00,"Jan 7, 2011-

Five guys stood at the front of the room wearing khadas and garlands of marigolds. Each took a turn making a speech into the microphone, thanking those who helped him achieve the milestone reached today and describing the obstacles on the road to get there. The speeches were followed by cake cutting and every combination of group photos possible. This was no ordinary award ceremony, it was a one-year birthday celebration of sobriety, and all five guys had, through hard work and struggle, managed to stay off intravenous drugs for a full year.

In his speech, one of the celebrants, Rakesh (name changed), explained how after six ‘tours’ of rehab and eight years involved in treatment, his family no longer believed his desire to be clean. “One day I went home and told my mom that I was leaving tomorrow for the centre. She said to me, ‘What are you going to do at the centre? The other ones didn’t work—you’ll be back within three or four months, using drugs again.’” But today Rakesh had achieved the one-year mark of sobriety and he was extremely proud of his accomplishment. “I’m happy because earlier I wasn’t able to stay in a centre for even three or four months, but now I have been clean for a whole year. I’ve left a lot of things behind.”

The birthday celebration is a common part of sobriety programmes, most notably Alcoholics Anonymous (AA), founded in 1935 in the US, and its sister organisation, Narcotics Anonymous, which is better known in Nepal as NA. It is also a hugely important component of addiction rehabilitation programmes in Nepal, which are heavily based on the theory of the twelve steps and practices of AA and NA. The twelve steps are a set of guiding principles for addiction recovery, developed by AA, that form the basis of most rehabilitation programmes. The first and most famous step is admitting powerlessness over alcohol or drugs.

This close modelling of Nepali rehabs after programmes in the US owes to the fact that the first centre in the country, Freedom Centre, was started in 1983 by an American pastor, the late Father Thomas Gaffney, and his Nepali partner who later travelled to the US to take inspiration from other centres. Since then, however, Nepali rehabs have evolved by mixing local cultural and societal norms such as an emphasis on social hierarchy with the American rehab programme basis, which emphasises the strength of fellowship—a close group of equals sharing experiences and interests, who share a history of drug use and the desire to stop using. The rehab programme at most centres in Nepal is a three-month residential programme (a little longer than the typical 30-60 day programme in the US) where clients live full-time at the centre, followed by nine months of after-care, during which clients attend the centre during the day and return home at night. The culmination of these 12 months is the birthday celebration, after which clients are set free to employ the skills and strategies they learned during rehab to stay sober outside the centre’s walls.

As exciting as celebrating the first birthday is, it can be a difficult time for people who have spent an entire year under close supervision of a tight network of recovery influences. In an already difficult economy, jobs are scarce for recovering drug users. Unlike in the urban US, where people typically have higher levels of mobility and education, recovering drug users in Nepal usually leave the centre and return to the same house and neighbourhood they grew up in, where everybody knows their secrets and drug-using status.

Just a few days after the high of his birthday celebration, Rakesh was coming down. “I haven’t taken nashaa (intoxicants), but everything else is bad,” he said, echoing a common recovery phrase which means that aside from a fragile sobriety, nothing is going well. Rakesh explained that as he no longer attended the centre (where he had spent six days a week for almost a year) his days were now spent sleeping until 5:00 pm after which he could expect to meet other recovering friends at Basantapur, where many in recovery spend their evenings as part of a ‘recovery fellowship’.

Like many other recovering users, Rakesh struggled to find employment with his limited education and virtually no work experience. In a community where jobs are typically garnered through connections, Rakesh’s connections all knew him as a drug user and feared hiring someone with that reputation, for he may steal money to use drugs again. Another recovering user confirmed their suspicions: he had lost his job after stealing 25,000 rupees from his boss to buy drugs. Besides, the livelihood programmes aimed to counter unemployment typically amount to little more than small handicraft work like candle- making, which is unlikely to provide substantial work or income to clients once they leave the centre.

The more than 40 rehab centres in Kathmandu do not have accurate records on relapse, but all acknowledge that rates are high. This is true in the US as well where relapse rates hover around 50 percent. Sustained sobriety is difficult to achieve and many of the economic and societal pressures that push Nepali people towards drug use—such as limited education, unemployment and few work opportunities, and strained family relationships in joint households—still exist once the year of treatment has ended. While the rehab centre offers a place and time to focus on sobriety, the emphasis on concrete ways to stay clean after treatment is not as strong.

In addition to the lack of social support and employment skills, recovering drug users fall victim to a dozen redundant practices adopted from the American system. Many slogans recovering users learn and are supposed to internalise, for example, do not work in the cultural context here. One of the most popular is the ‘ABC’ or Avoid Bad Circle slogan, which instructs recovering drug users to avoid friends and the old drug-using area. For Rakesh, who cannot move out from his family’s house, and whose old using partners lives just down the street, this is virtually impossible. “Once I come home, I don’t go outside. Down the block is my using partner. I only leave if I have any work or to go to the centre,” he explained. Another client who struggled to stay clean after leaving the centre and was known in Thamel for dealing agreed, “I try to hide and walk. But still, people [other users] say, ‘Oi! Come here.’”

Another practice that is lost in translation is the reliance on English language in meetings and programmes. English phrases like ‘self-esteem’ are used without an appropriate Nepali explanation, to clients who do not speak English. Clients themselves use these phrases, often without a good understanding of their meaning. It is incredibly difficult for recovering drug users in Nepal to achieve lasting sobriety. The large number of centres, emergence of AA and NA meetings, and greater awareness of drug use in Kathmandu is a step in the right direction. But it’s time to take it a step further and focus on serious job training and employment assistance, and to choose not to use inappropriate practices adopted years ago from the US system. Societal acceptance too will go a long way in allowing recovering users to move past their drug-using identity and turn a fragile sobriety into a lasting one.

After re-entering the centre for an abbreviated treatment after his 7th relapse, Rakesh was offered a job by a relative and has been able to maintain his sobriety by focusing on work. Every day is a struggle and Rakesh recognises that his sobriety continues to be extremely fragile. But he is counting down the months until he will celebrate his one-year birthday again.

(Danielle Priess, a visiting Fulbright scholar, researched the drug rehabilitation centres in Kathmandu)

Published: 08-01-2011 09:45","['recovery', 'sobriety', 'clients', 'recovering', 'programmes', 'centre', 'road', 'drug', 'users', 'rakesh', 'long', 'work', 'rehab']","In an already difficult economy, jobs are scarce for recovering drug users.
Like many other recovering users, Rakesh struggled to find employment with his limited education and virtually no work experience.
In addition to the lack of social support and employment skills, recovering drug users fall victim to a dozen redundant practices adopted from the American system.
One of the most popular is the ‘ABC’ or Avoid Bad Circle slogan, which instructs recovering drug users to avoid friends and the old drug-using area.
Societal acceptance too will go a long way in allowing recovering users to move past their drug-using identity and turn a fragile sobriety into a lasting one."
Hard-drinking Lithuania wages battle against vodka,"Behind a heavy wooden door next to a Vilnius church, a couple of dozen Lithuanian men are talking about their dependence on alcohol. The moderator is Kestutis Dvareckas, a priest and a decade sober.",,2017-08-30 00:00:00,"Aug 30, 2017-

Behind a heavy wooden door next to a Vilnius church, a couple of dozen Lithuanian men are talking about their dependence on alcohol. The moderator is Kestutis Dvareckas, a priest and a decade sober.

The World Health Organization ranks Lithuanians as the world’s heaviest drinkers.

WHO estimates published in May pegged average annual consumption at 18.2 litres (4.8 gallons) of pure alcohol per person in 2016, putting the small EU Baltic state ahead of Belarus, Moldova and Russia.

“Drinking on the job had been tolerated on various occasions since the Soviet era. Today, you still see alcohol at baptisms and burials,” Father Dvareckas, 37, told AFP. Rather than being social, drinking on these occasions is often excessive to the point of passing out.

Poor mental health and coping skills play a role, especially among Lithuanian men. WHO statistics from 2014 show that 16.7 percent of them abused alcohol or were dependent on it.

Largely at fault is “Lithuanian pessimism”, according to Visvaldas Legkauskas, a psychologist at Vytautas Magnus University in the central city of Kaunas.

“Life isn’t too bad here, but we have this character trait and we drown our sorrows in alcohol or we commit suicide,” he told AFP.

Dvareckas says he managed to quit drinking and get his life back thanks to a 12-step programme similar to the one used by Alcoholics Anonymous and the support of friends and family.

Wanting to pass on what he learnt, he created the free programme As Esu (“I am” in Lithuanian) in 2009, whose combination of group meetings, prayer, therapy and work opportunities help alcoholics get back on their feet.

An association created this year forged a network allowing 20 such communities to share resources. Other initiatives such as Alcoholics Anonymous are also afoot.

Burdened by the high social costs of heavy drinking, the government is taking action to curb consumption, including tax hikes and a blanket ban on alcohol advertising.

Fighting alcoholism was among the key campaign promises that gave the Lithuanian Peasants and Greens Union (LPGU) a surprise victory in 2016 elections. Its leader has been organising a booze-free cultural festival in his village for a decade.

Although parliament raised the tax on alcohol in March, consumption did not fall in the eurozone state of nearly three million residents.

Lawmakers then voted by a large margin in June to raise the legal drinking age to 20 from 18 and introduce a blanket ban on alcohol ads next year.

Whether these measures will work is another matter.

“Already back in 1998, Lithuania had adopted a strategy to curb consumption by 25 percent. But the reality is that it went up by 130 percent instead,” Health Minister Aurelijus Veryga told AFP.

For Father Dvareckas, the new legislation is not enough: “Why do I still have to pass the alcohol shelf at stores before reaching the one with dairy products?”

At a local store in the village of Semeliskes, located 20 kilometres (12 miles) from Vilnius, a saleswoman named Ona is sceptical.

“Prices may have gone up, but no one really cares. People will continue to buy as long as they have money, and they’ll buy five bottles instead of one to make sure they’re stocked,” she told AFP.

Many believe that to really be effective, the restrictions affecting sales must be coupled with other forms of help.

Medical treatment of alcoholics is still spotty in Lithuania, where the necessary medication is not paid for by the state, according to the national health insurance fund.

There are only five state-run alcohol rehab centres across Lithuania.

For Veryga, the health minister, it is critical “to ensure equal access to everyone concerned in the various regions”.

Published: 30-08-2017 09:54","['vodka', 'alcoholics', 'lithuania', 'told', 'harddrinking', 'dvareckas', 'battle', 'state', 'health', 'consumption', 'wages', 'drinking', 'lithuanian', 'alcohol', '20']","Today, you still see alcohol at baptisms and burials,” Father Dvareckas, 37, told AFP.
Although parliament raised the tax on alcohol in March, consumption did not fall in the eurozone state of nearly three million residents.
“Already back in 1998, Lithuania had adopted a strategy to curb consumption by 25 percent.
Medical treatment of alcoholics is still spotty in Lithuania, where the necessary medication is not paid for by the state, according to the national health insurance fund.
For Veryga, the health minister, it is critical “to ensure equal access to everyone concerned in the various regions”."
Sympathy for the user,"Our minds are structured in such a way that forbidden things hold far greater potential for satisfaction (albeit, perhaps, only psychological), than the things we are meant, and expected, to do. This fascination and desire for what is denied persists but as we grow older, we start choosing things that make sense, things that everybody says makes sense.",,2018-08-25 00:00:00,"Aug 25, 2018-

Our minds are structured in such a way that forbidden things hold far greater potential for satisfaction (albeit, perhaps, only psychological), than the things we are meant, and expected, to do. This fascination and desire for what is denied persists but as we grow older, we start choosing things that make sense, things that everybody says makes sense.

Of the many ‘Do-nots’ in our society are drugs. Do not do drugs. No further questions. They are bad for you. How bad? Are they worse than the other addictive substances and tendencies that society deems worthy of being ‘legal’? These questions fall by the wayside before even registering into mass consciousness.

Drugs, by definition, are substances that alter our pattern of activity—of processing thought, stimulations, everything. Some help keep us alive (in the physical sense) whereas, some by chance, create a dangerous vortex that swallows thoughts and lives whole. Thus, we separate what society terms medicine from what it calls drugs. It is the same with addiction. If it’s severe enough to mess up your social and personal life and space, it’s an addiction.

When an adolescent brain sees a skull and crossbones sign, chances are the danger and forbiddance will have them gravitating towards it. A vicious cycle can then result in a roundabout of deviant behaviour, marginalisation by society, neglect, burden, even death.

There has, throughout millennia, persisted a view of ‘drugs’ as inherently bad. That anyone who does drugs is not for society, is morally wrong. We shall call this the moral model. Once you marginalise a person from society for being morally corrupt, you start the process of dehumanising them. The treatment of those times reflected this. Confinement, punishment and even religious indoctrination were commonplace (even the Alcoholics Anonymous with its inflated success rates collected from telephone interviews, started with a dabble into the religious and later, the spiritual.)

This view has now been confined and banished to the island where bad ideas go to complain how unfair society is. We now know that drugs use is not as simple as a good/bad dichotomy. There are numerous variables that are at play, leading to substance abuse and dependence. There are numerous variables that increase one’s chances of addictive behaviour. Not all people who experiment with drugs go down its rabbit hole, and not all who go down fail to come out again. This approach to substance abuse and addiction has led to what is now the medical model. This model believes in finding out the root causes and psychopathology behind the behaviour. These could be as wide ranging as a South American shaman drinking ayahuasca to connect to mother earth and sadhus smoking ganja for a multitude of reasons to a college kid trying ‘brown sugar’ due to some misguided idea of ‘being cool’ and a professional adding a shot of vodka in their morning coffee before driving to work because he’s a bit uptight about the day’s presentation. There will always be reasons. We as psychiatrists and addiction specialists must find those reasons. In the best cases, we help find solutions and in the worst, help them live with it.

There have been and will always be drugs. It is society that has to coexist. Whether we do this by understanding addictive human behaviour and how drugs work, or by criminalising drug-related behaviour and legally or forcefully locking up people depends on us. Unfortunately, due to factors like lack of knowledge, confusion due to conflicting messages from various sources and the patient not having a say leads to many people still strongly believing this primitive idea that bad intentions and weak morals lead to drug use.

Experimentation is how human beings learn. We do things and stick with things that work. Not all people who do any particular drug become addicted to it. In fact, only 15 percent who drink alcohol will develop abuse or addiction problems. These studies have also been replicated in mice and show huge promise for the isolation of the ‘addiction gene’. There must be individual treatment plans in place for people with uniquely different problems. Experimental use, while being discouraged and managed as it should, must never be equated with the problematic use of substances. Shaming and forcing users to quit hardly seems like a long-term solution.

Prevention, of course, is the primary goal. But, how we go about that is paramount. Removing moral labels would be a good start. Current treatment methods, if they can be called that, are appallingly primitive. They need upgrading on all fronts; psychotherapeutic, pharmacotherapeutic and even the regulation of so-called rehabs. Then, there is maintenance. Unless something positive and fulfilling takes up the space previously occupied by drugs, the person will keep on going back to what they know best. There’s even a code name for people who are admitted to rehabs repeatedly.

I’ll finish with something a patient of mine told me when asked what he had achieved from his four stints at (various) rehabs: “I made a lot of damn good contacts, doc!”

Swar is an addiction psychiatrist and can be reached at sikharbahadurswar@yahoo.com. He is currently affiliated with Possible Health and Sushma Koirala Memorial Hospital.

Published: 25-08-2018 08:17","['things', 'society', 'addiction', 'bad', 'treatment', 'drugs', 'behaviour', 'start', 'substances', 'sympathy', 'user', 'work']","This fascination and desire for what is denied persists but as we grow older, we start choosing things that make sense, things that everybody says makes sense.
Are they worse than the other addictive substances and tendencies that society deems worthy of being ‘legal’?
Drugs, by definition, are substances that alter our pattern of activity—of processing thought, stimulations, everything.
A vicious cycle can then result in a roundabout of deviant behaviour, marginalisation by society, neglect, burden, even death.
Whether we do this by understanding addictive human behaviour and how drugs work, or by criminalising drug-related behaviour and legally or forcefully locking up people depends on us."
heads and tales,"Here in this great land of ours, we have a real superhero now and his name is ‘Lokman’",,2013-05-10 00:00:00,"May 10, 2013-

The Amrikis have Superman, Spider Man, Batman and Iron Man and, of course, many other ‘-mans’. But they are all just a bunch of fictional superheroes. Tony Stark is a billionaire and uses his powered suit of armour to protect the world as Iron Man.

We too have our own ‘Nepali’ billionaire in the Forbes list and he is real, alive and kicking just like you and me. Let us all hope that Binod dai will find ways to use his wealth to help the poor and the needy. He could follow the Warren Buffet formula and give most of his wealth to charity after he is gone and leave some pocket money for his kids. The chump change would still be enough for his kids to live a privileged life.

If he can come up with a fancy costume then he can be a superhero as well. The difficult part is finding the right name when he dons a costume. He could be the ‘Wai Wai Man’, who helps hungry folks with a free packet of Wai Wai. But eating only instant noodles will not make us healthy. Maybe Binod dai should invest in them apple farms in Jomson and we could get a free apple for every packet of Wai Wai we buy. At least them apples might compensate for a high sodium and low-fibre diet.

Here in this great land of ours, we have a real superhero now and his name is ‘Lokman’. Our beloved president has appointed him to head one of the most incompetent government bodies in Nepal—the Commission for Investigation of Abuse of Authority (CIAA). Well, we still have yet to find an efficient government agency. That would be like trying to find dinosaur footprints in the middle of Ratnapark.

The CIAA has yet to find any politicians guilty of corruption. Well, a few former ministers went to prison and all they got was a year and half in Dillibazar Prison. The CIAA found our former IGPs guilty in the ‘Sudan APC Scam’ but what about our former home ministers and other political leaders who probably made some dough as well?

Superhero Lokman was the chief secretary during Gyanu Uncle’s direct rule. Does that make him an evil monster? No! He was just doing his job. After all, one cannot go far up the ladder if one does not kiss them arses. According to our media wallahs, the Maoists & Madhesis (M&Ms) wanted Lokman while the Nepali Kangaroos and the Unidentified Moronic Losers were pressured to support his appointment. Our clowns talk about foreign pressure every time they can’t agree on something.

Maybe our clowns wanted Lokman so that he would spend his days reading newspapers and drinking doodh chiya. If they left Lokman alone, then he’d do everything in his power to prevent any investigation of abuse of authority by our ‘new age’ clowns.

Or is it the other way around? It takes a crook to catch a crook. So far, our clowns have been running around town, shouting ‘catch me if you can’ and we have yet to find anyone from the days of the Shree Tins who are guilty of anything…till now.

So the CIAA should just shut down its offices and open a counselling centre for Amriki spies. It could be a ‘CIA Anonymous’ like the Alcoholics Anonymous. All CIA wallahs who have problems can visit and get some counselling from the CIAA. What could we teach them kuireys? Nothing, really, but our clowns can ask them to give us suitcases full of dollars like the ones Hamid Karzai receives.

When the bidhesis throw a tantrum, our clowns will do anything to pacify them. When we Nepalis throw a tantrum, they send the Nepal Police to show us their skills in laathi-charging! The bideshis threaten to cut down them foreign aid if they are not happy with our buffoons. And if there is no aid then there won’t be much room left for commissions.

No wonder, then, that a kuire can walk around town at two in the morning and the police will ignore him because they don’t want to waste their time learning English 101. If it’s a Nepali, then the police wallah will suddenly have enough questions to turn the investigation into some kind of a session with Sigmund Freud. We have yet to let go of that ‘white man—must be a rich man’ natak!

Our student unions want the government to send Lokman home. The smaller fishes want the president to resign. Leave Lord Rama alone. If Lokman can come back then why not bring Lord Vishnu as well? At least Gyanu Uncle can be the chief guest for all them jatras in the Valley.

Our student unions should gherao the Foreign Ministry and demand that Dorje Gurung, a former teacher at Qatar Academy, is freed from a Doha jail so he can come home and go trekking, rafting or even paragliding.

Guffadi blogs at www.guffadi.blogspot.com. You may contact him at maguffadi@gmail.com

Published: 11-05-2013 08:35","['foreign', 'clowns', 'lokman', 'come', 'tales', 'heads', 'man', 'nepali', 'guilty', 'ciaa', 'wai', 'investigation']","May 10, 2013-The Amrikis have Superman, Spider Man, Batman and Iron Man and, of course, many other ‘-mans’.
Tony Stark is a billionaire and uses his powered suit of armour to protect the world as Iron Man.
He could be the ‘Wai Wai Man’, who helps hungry folks with a free packet of Wai Wai.
Maybe Binod dai should invest in them apple farms in Jomson and we could get a free apple for every packet of Wai Wai we buy.
Maybe our clowns wanted Lokman so that he would spend his days reading newspapers and drinking doodh chiya."
