Headlines,Descriptions,Authors,Published_Dates,Articles,Keywords,Summaries
Angelina Jolie questioned by FBI,Actress Angelina Jolie was questioned by the Federal Bureau of Investigation (FBI) for four hours over her estranged husband and actor Brad Pitt's private plane incident.,,2016-10-27 00:00:00,"Oct 27, 2016-

Actress Angelina Jolie was questioned by the Federal Bureau of Investigation (FBI) for four hours over her estranged husband and actor Brad Pitt's private plane incident.

Pitt is alleged to have gotten ""verbally abusive"" and ""physical"" with their son Maddox, 15, while under the influence of alcohol during a flight on September 14 and Jolie filed for divorce just days later.

After an anonymous source reported the alleged incident, the FBI got involved as they have jurisdiction because the incident occurred in mid-air.

""The agents wanted a breakdown of everything that happened from when the plane took off to when it landed. Angelina fully cooperated,"" a source told usmagazine.com.

The source added that the FBI ""will likely investigate for another few weeks"". After that they ""will present the case to the prosecutor, who will evaluate whether they feel the need to bring charges. It could potentially be months"".

Yet both Pitt and Jolie are eager to avoid a court case, with the source explaining: ""Neither side wants this to go to court because everything the FBI and DCFS (Department of Children and Family Services) investigated will potentially be made available to the public, which would be bad for the entire family.""

It was later reported that ""Maddox suffered no injuries and some witnesses on the jet say Brad's contact with the boy was inadvertent"".

Meanwhile, it has been reported that DCFS have extended their investigation into Pitt.

The two and their children -- Maddox, Pax, 12, Zahara, 11, Shiloh, 10, and eight-year-old twins Knox and Vivienne -- have all been previously interviewed. The DCFS has now expanded its investigation to other alleged incidents.

Jolie and Pitt have agreed on a parenting plan, giving the actress temporary physical custody over the children with Pitt allowed to visit them under the supervision of a therapist.

Published: 27-10-2016 16:00","['jolie', 'alleged', 'fbi', 'reported', 'children', 'source', 'pitt', 'maddox', 'angelina', 'questioned', 'dcfs', 'investigation']","Oct 27, 2016-Actress Angelina Jolie was questioned by the Federal Bureau of Investigation (FBI) for four hours over her estranged husband and actor Brad Pitt's private plane incident.
After an anonymous source reported the alleged incident, the FBI got involved as they have jurisdiction because the incident occurred in mid-air.
The source added that the FBI ""will likely investigate for another few weeks"".
The two and their children -- Maddox, Pax, 12, Zahara, 11, Shiloh, 10, and eight-year-old twins Knox and Vivienne -- have all been previously interviewed.
Jolie and Pitt have agreed on a parenting plan, giving the actress temporary physical custody over the children with Pitt allowed to visit them under the supervision of a therapist."
Nepal 2030,"In Nepal, long-term thinking is always seen as a formality. The concept of long-term planning has never been embedded in our thinking, although culturally, we participate in many rituals and deeds that look beyond the present time to our afterlife.",,2016-07-19 00:00:00,"In villages, people who buy motorcycles, smartphones and lots of alcohol with their own money, wait for the assistance of some government body or NGO to build a toilet in their house

Jul 19, 2016-In Nepal, long-term thinking is always seen as a formality. The concept of long-term planning has never been embedded in our thinking, although culturally, we participate in many rituals and deeds that look beyond the present time to our afterlife. And this continues to be the paradox: People who perform rituals to “fix” their afterlife and ensure that their children continue them for the same purpose fail to focus on long-term planning for themselves, their family or their organisations. Many ‘poverty specialists’ attribute this phenomenon—where people are only focused on their day-to-day living and are unable to think beyond two square meals—to extreme poverty and a series of famines in earlier centuries. But perhaps, Nepal has come a long way as indicated by our achievements of Millennium Development Goals (MDG). Sailesh Tiwari, who authored a World Bank report titled ‘Moving up the ladder: poverty reduction and social mobility in Nepal’, explains how Nepal has been able to reduce poverty in a time span comparable with countries like China. It is important for Nepal to prepare for the future and set some long-term goals.

Dependency syndrome

Culturally, the dependency syndrome that prevails in developing society like ours, fueled by the presence of free money, creates complications when it comes to vision for the future. In many Nepali families, a young man waits to furnish his room from the dowry he will receive. In villages, people who buy motorcycles, smartphones and lots of alcohol with their own money, wait for the assistance of some government body or NGO to build a toilet in their house. College kids rely on donations from companies and organisations to finance their fun-filled excursions, and political parties rely on anonymous funds, usually with strings attached, to help them run for elections. Banks with over half a billion of market capitalisation wait for some donor to subsidise the opening of a branch or the organisation of a programme. Dependency, in contrast to internal will, is one of the biggest impediments to making long-term plans. Dependency kills innovation, which is a key ingredient to envision the future.

Growth and investments

For Nepal to graduate to a middle-income country by 2030, when the country’s population will be around 36 million, it needs a $100 billion dollar economy with a per capita income of $2,500. To reach this mark, we need over eight percent growth each year. Economic growth can only occur if there are investments in infrastructure, entrepreneurship development and employment generation. This would require an investment of about $7 to 8 billion each year. Domestic investment capacities do not exceed $2 billion a year at present, which means we need foreign investment. Now if we are to attract foreign investment, we need a whole set of reforms that will enable us to compete with other nations. For many years, Nepal has been a country that receives one of the lowest foreign investments in the world. The inward looking Nepali society and businesses run by protectionist cartels and syndicates are keeping foreign investors at bay. We need to open up. What is the point of having a stock market with $15 billion market capitalisation when neither foreign investors are permitted to invest in it nor international players are allowed to recalibrate the market with an injection of contemporary technology and services? Cocooning ourselves from the outside world and finding newer protectionists strategies in the name of nationalism will continue to ail the country’s economy, a problem of over 200 years.

Certain milestones excite people globally. In the past, the turn of the century was

a big one; 2020 is considered another big milestone that pushed countries like Malaysia to conquer poverty and unleash economic potential. There are many countries that have been able to grow at a fast pace in last two to three decades. Landlocked Ethopia, for example, increased its GDP four times from $16 billion to $60 billion in ten years. Rwanda, during the same time period, grew three times. Nepal, however, could only double its GDP in that period. Countries like Ivory Coast that were written off are on the march to attract billions of dollars in foreign investments to unleash economic growth.

Formal and informal

Given the performances of countries similar to Nepal, it is not impossible for us to grow to become a $100 billion economy and

graduate to a middle-income country by 2030. For this, a big part of the

informal economy of the country needs to be converted into the formal economy by acquiring reliable statistics and expanding the taxation net. A large chunk of our economy is informal, which is very common in countries like ours, but it needs to graduate to formal economy at a quicker pace.

The six months of black marketeering pushed many formal sectors into the

fold of the informal, and the tendency to cheat the state and the consumers never ceases. Embracing global practices, facilitating tax payment, making government accountable and getting rid of a dependency mindset will all help us to convert a bigger part of the informal economy into the formal economy.

Nepal Economic Forum is publishing Nepal 2030 as its 25th anniversary issue of its publication nefport, bringing in many practitioners to share their thoughts on contextualising as well as comprehending the journey ahead for the country.

Published: 19-07-2016 10:47","['foreign', 'market', 'investment', 'poverty', 'longterm', 'need', 'nepal', 'countries', '2030', 'economy', 'billion']","But perhaps, Nepal has come a long way as indicated by our achievements of Millennium Development Goals (MDG).
Sailesh Tiwari, who authored a World Bank report titled ‘Moving up the ladder: poverty reduction and social mobility in Nepal’, explains how Nepal has been able to reduce poverty in a time span comparable with countries like China.
Growth and investmentsFor Nepal to graduate to a middle-income country by 2030, when the country’s population will be around 36 million, it needs a $100 billion dollar economy with a per capita income of $2,500.
Formal and informalGiven the performances of countries similar to Nepal, it is not impossible for us to grow to become a $100 billion economy andgraduate to a middle-income country by 2030.
Nepal Economic Forum is publishing Nepal 2030 as its 25th anniversary issue of its publication nefport, bringing in many practitioners to share their thoughts on contextualising as well as comprehending the journey ahead for the country."
"Gunman kills nine at Oregon college, dies in shootout with police","A gunman stalked onto a college campus in southwestern Oregon on Thursday and opened fire, killing nine people and wounding seven before police shot him to death.",,2015-10-02 00:00:00,"People take part in candle light vigil following a mass shooting at Umpqua Community College in Roseburg, Oregon on Thursday.

Oct 2, 2015-

A gunman stalked onto a college campus in southwestern Oregon on Thursday and opened fire, killing nine people and wounding seven before police shot him to death, authorities said, in yet another burst of U.S. gun violence that ranked as the deadliest this year.

The suspect, who witnesses say fired dozens of shots into a classroom full of screaming students, was slain in an exchange of gunfire with two police officers in Snyder Hall at Umpqua Community College in Roseburg following the morning rampage.

He was not publicly identified by local authorities - the county sheriff vowed never to utter his name. But CBS, CNN, NBC and the New York Times named him as 26-year-old Chris Harper-Mercer, citing anonymous law enforcement sources.

""He appears to be an angry young man who was very filled with hate,"" the Times quoted one law enforcement official as saying.

CNN reported that three handguns and a ""long gun"" belonging to him were recovered from the scene. According to published eyewitness accounts, the gunman at one point ordered cowering students to stand up and state their religion before spraying the classroom with bullets.

""The law enforcement investigation into the shooter and his motivations is continuing,"" Douglas County Sheriff John Hanlin told reporters at an afternoon news conference.

He also said three of the wounded victims were hospitalized in critical condition.

The massacre in Roseburg, a former timber town on the western edge of the Cascades some 260 miles (418 km) south of Portland, was the latest in a flurry of deadly mass shootings at American college and public school campuses, movie theaters, military bases and churches in recent years.

The 10 people killed surpassed the death tolls from two previous mass shootings - a gun battle between rival motorcycle gangs in Waco, Texas, in May, and the rampage of a gunman at a black church in Charleston, South Carolina, each of which claimed nine lives - to mark the deadliest incident of gun violence in the United States this year.

Not counting Thursday's carnage, a total of 293 mass shootings have been reported since January 2015, according to the Mass Shooting Tracker website, a crowd-sourced database kept by anti-gun activists that defines a mass shooting as any event in which four or more people are shot.

The killings have fueled demands for more gun control in the United States, where ownership of firearms is protected by the Second Amendment of the U.S. Constitution, and better care for the mentally ill.

President Barack Obama, speaking just hours after the rampage, said the mass killing should move Americans to demand greater gun controls from elected officials.

""Somehow this has become routine,"" a visibly angry Obama said. ""The reporting is routine. My response here, at this podium, ends up being routine. ...We’ve become numb to this.""

GUNSHOTS AND SCREAMS

Kortney Moore, 18, told the local News Review newspaper that she was in her writing class in Snyder Hall when a gunshot came through the window and struck her teacher in the head.

Inside the classroom, Moore said, the gunman told people to get on the ground, then asked them to stand up and state their religion before he started shooting.

Freshman Kenny Ungerman told NBC that said he saw the shooter, dressed in jeans and a T-shirt, carrying a handgun as he went into the building, followed by gunshots and screams. Student Cassandra Welding told CNN that she heard 35 to 40 shots.

Student Brady Winder, in a posting on Facebook, said he was in a classroom next door to the room where the shooting began and ran, along with his classmates, when they heard the gunfire.

""I ran to the edge of the campus, down a hill and waited. From talking with a student in the classroom where it happen, almost every person in the room was shot by a man with four guns,"" Winder, 23, wrote.

PeaceHealth Sacred Heart Medical Center emergency room doctor Hans Notenboom told reporters three women about 18 to 34 years of age were flown to the hospital in Riverbend by helicopter, and two were moved directly into operating room.

Survivors were transported to a local fairgrounds, and some family members were left waiting for hours to see if their loved ones would be among them.

""We have grief counselors waiting for those parents who have no children getting off that bus,"" said the college's president, Rita Calvin.

Following the bloodshed state and federal authorities swarmed Roseburg, including agents from the Federal Bureau of Investigation and the U.S. Bureau of Alcohol, Tobacco, Firearms and Explosives.

Police descended on an apartment possibly linked to the suspect about 2 miles (3 km) from campus, where police tape prevented access. It was not immediately clear who lived in the residence.

The college, which began its fall term this week and serves more than 13,000 students - 3,000 of them full time - said it would be closed until Monday. Hundreds of people attended a candlelight vigil at nightfall.

In 2012, seven students at the small Christian college Oikos University in Oakland, California, were shot dead by a former student, marking the deadliest outburst of violence at a U.S. college since April 2007, when a student at Virginia Tech University killed 32 people and wounded 25 others before taking his own life.

Published: 02-10-2015 10:29","['told', 'students', 'shootout', 'oregon', 'mass', 'shooting', 'roseburg', 'gunman', 'college', 'gun', 'classroom', 'kills', 'dies', 'student']","People take part in candle light vigil following a mass shooting at Umpqua Community College in Roseburg, Oregon on Thursday.
But CBS, CNN, NBC and the New York Times named him as 26-year-old Chris Harper-Mercer, citing anonymous law enforcement sources.
According to published eyewitness accounts, the gunman at one point ordered cowering students to stand up and state their religion before spraying the classroom with bullets.
Not counting Thursday's carnage, a total of 293 mass shootings have been reported since January 2015, according to the Mass Shooting Tracker website, a crowd-sourced database kept by anti-gun activists that defines a mass shooting as any event in which four or more people are shot.
Inside the classroom, Moore said, the gunman told people to get on the ground, then asked them to stand up and state their religion before he started shooting."
The long road to recovery,Redundant rehab practices and social pressure hinder recovering drug users from sustaining their sobriety,,2011-01-07 00:00:00,"Jan 7, 2011-

Five guys stood at the front of the room wearing khadas and garlands of marigolds. Each took a turn making a speech into the microphone, thanking those who helped him achieve the milestone reached today and describing the obstacles on the road to get there. The speeches were followed by cake cutting and every combination of group photos possible. This was no ordinary award ceremony, it was a one-year birthday celebration of sobriety, and all five guys had, through hard work and struggle, managed to stay off intravenous drugs for a full year.

In his speech, one of the celebrants, Rakesh (name changed), explained how after six ‘tours’ of rehab and eight years involved in treatment, his family no longer believed his desire to be clean. “One day I went home and told my mom that I was leaving tomorrow for the centre. She said to me, ‘What are you going to do at the centre? The other ones didn’t work—you’ll be back within three or four months, using drugs again.’” But today Rakesh had achieved the one-year mark of sobriety and he was extremely proud of his accomplishment. “I’m happy because earlier I wasn’t able to stay in a centre for even three or four months, but now I have been clean for a whole year. I’ve left a lot of things behind.”

The birthday celebration is a common part of sobriety programmes, most notably Alcoholics Anonymous (AA), founded in 1935 in the US, and its sister organisation, Narcotics Anonymous, which is better known in Nepal as NA. It is also a hugely important component of addiction rehabilitation programmes in Nepal, which are heavily based on the theory of the twelve steps and practices of AA and NA. The twelve steps are a set of guiding principles for addiction recovery, developed by AA, that form the basis of most rehabilitation programmes. The first and most famous step is admitting powerlessness over alcohol or drugs.

This close modelling of Nepali rehabs after programmes in the US owes to the fact that the first centre in the country, Freedom Centre, was started in 1983 by an American pastor, the late Father Thomas Gaffney, and his Nepali partner who later travelled to the US to take inspiration from other centres. Since then, however, Nepali rehabs have evolved by mixing local cultural and societal norms such as an emphasis on social hierarchy with the American rehab programme basis, which emphasises the strength of fellowship—a close group of equals sharing experiences and interests, who share a history of drug use and the desire to stop using. The rehab programme at most centres in Nepal is a three-month residential programme (a little longer than the typical 30-60 day programme in the US) where clients live full-time at the centre, followed by nine months of after-care, during which clients attend the centre during the day and return home at night. The culmination of these 12 months is the birthday celebration, after which clients are set free to employ the skills and strategies they learned during rehab to stay sober outside the centre’s walls.

As exciting as celebrating the first birthday is, it can be a difficult time for people who have spent an entire year under close supervision of a tight network of recovery influences. In an already difficult economy, jobs are scarce for recovering drug users. Unlike in the urban US, where people typically have higher levels of mobility and education, recovering drug users in Nepal usually leave the centre and return to the same house and neighbourhood they grew up in, where everybody knows their secrets and drug-using status.

Just a few days after the high of his birthday celebration, Rakesh was coming down. “I haven’t taken nashaa (intoxicants), but everything else is bad,” he said, echoing a common recovery phrase which means that aside from a fragile sobriety, nothing is going well. Rakesh explained that as he no longer attended the centre (where he had spent six days a week for almost a year) his days were now spent sleeping until 5:00 pm after which he could expect to meet other recovering friends at Basantapur, where many in recovery spend their evenings as part of a ‘recovery fellowship’.

Like many other recovering users, Rakesh struggled to find employment with his limited education and virtually no work experience. In a community where jobs are typically garnered through connections, Rakesh’s connections all knew him as a drug user and feared hiring someone with that reputation, for he may steal money to use drugs again. Another recovering user confirmed their suspicions: he had lost his job after stealing 25,000 rupees from his boss to buy drugs. Besides, the livelihood programmes aimed to counter unemployment typically amount to little more than small handicraft work like candle- making, which is unlikely to provide substantial work or income to clients once they leave the centre.

The more than 40 rehab centres in Kathmandu do not have accurate records on relapse, but all acknowledge that rates are high. This is true in the US as well where relapse rates hover around 50 percent. Sustained sobriety is difficult to achieve and many of the economic and societal pressures that push Nepali people towards drug use—such as limited education, unemployment and few work opportunities, and strained family relationships in joint households—still exist once the year of treatment has ended. While the rehab centre offers a place and time to focus on sobriety, the emphasis on concrete ways to stay clean after treatment is not as strong.

In addition to the lack of social support and employment skills, recovering drug users fall victim to a dozen redundant practices adopted from the American system. Many slogans recovering users learn and are supposed to internalise, for example, do not work in the cultural context here. One of the most popular is the ‘ABC’ or Avoid Bad Circle slogan, which instructs recovering drug users to avoid friends and the old drug-using area. For Rakesh, who cannot move out from his family’s house, and whose old using partners lives just down the street, this is virtually impossible. “Once I come home, I don’t go outside. Down the block is my using partner. I only leave if I have any work or to go to the centre,” he explained. Another client who struggled to stay clean after leaving the centre and was known in Thamel for dealing agreed, “I try to hide and walk. But still, people [other users] say, ‘Oi! Come here.’”

Another practice that is lost in translation is the reliance on English language in meetings and programmes. English phrases like ‘self-esteem’ are used without an appropriate Nepali explanation, to clients who do not speak English. Clients themselves use these phrases, often without a good understanding of their meaning. It is incredibly difficult for recovering drug users in Nepal to achieve lasting sobriety. The large number of centres, emergence of AA and NA meetings, and greater awareness of drug use in Kathmandu is a step in the right direction. But it’s time to take it a step further and focus on serious job training and employment assistance, and to choose not to use inappropriate practices adopted years ago from the US system. Societal acceptance too will go a long way in allowing recovering users to move past their drug-using identity and turn a fragile sobriety into a lasting one.

After re-entering the centre for an abbreviated treatment after his 7th relapse, Rakesh was offered a job by a relative and has been able to maintain his sobriety by focusing on work. Every day is a struggle and Rakesh recognises that his sobriety continues to be extremely fragile. But he is counting down the months until he will celebrate his one-year birthday again.

(Danielle Priess, a visiting Fulbright scholar, researched the drug rehabilitation centres in Kathmandu)

Published: 08-01-2011 09:45","['recovery', 'sobriety', 'clients', 'recovering', 'programmes', 'centre', 'road', 'drug', 'users', 'rakesh', 'long', 'work', 'rehab']","In an already difficult economy, jobs are scarce for recovering drug users.
Like many other recovering users, Rakesh struggled to find employment with his limited education and virtually no work experience.
In addition to the lack of social support and employment skills, recovering drug users fall victim to a dozen redundant practices adopted from the American system.
One of the most popular is the ‘ABC’ or Avoid Bad Circle slogan, which instructs recovering drug users to avoid friends and the old drug-using area.
Societal acceptance too will go a long way in allowing recovering users to move past their drug-using identity and turn a fragile sobriety into a lasting one."
